{
  "$schema": "https://json-schema.org/draft/2020-12/schema",
  "title": "FS V0 CLI acceptance case",
  "type": "object",
  "additionalProperties": false,
  "required": ["id", "command", "arguments", "workspace", "stdin", "expect"],
  "properties": {
    "id": {
      "type": "string",
      "pattern": "^[a-z0-9]+(?:-[a-z0-9]+)*$"
    },
    "command": { "const": "fs" },
    "workingDirectory": {
      "enum": ["available", "unavailable"]
    },
    "arguments": {
      "type": "array",
      "items": { "type": "string" }
    },
    "workspace": {
      "type": "array",
      "items": { "$ref": "#/$defs/stagedFile" }
    },
    "stdin": {
      "oneOf": [
        { "type": "null" },
        { "$ref": "#/$defs/byteSource" }
      ]
    },
    "expect": { "$ref": "#/$defs/expectation" }
  },
  "$defs": {
    "repositoryFile": {
      "type": "string",
      "minLength": 1
    },
    "workspacePath": {
      "type": "string",
      "minLength": 1,
      "pattern": "^[A-Za-z0-9_-][A-Za-z0-9._-]*(?:/[A-Za-z0-9_-][A-Za-z0-9._-]*)*$"
    },
    "jsonPointer": {
      "type": "string",
      "pattern": "^(?:$|/)"
    },
    "byteSource": {
      "oneOf": [
        {
          "type": "object",
          "additionalProperties": false,
          "required": ["file"],
          "properties": {
            "file": { "$ref": "#/$defs/repositoryFile" }
          }
        },
        {
          "type": "object",
          "additionalProperties": false,
          "required": ["utf8"],
          "properties": {
            "utf8": { "type": "string" }
          }
        },
        {
          "type": "object",
          "additionalProperties": false,
          "required": ["generated"],
          "properties": {
            "generated": { "$ref": "#/$defs/generatedBytes" }
          }
        }
      ]
    },
    "generatedBytes": {
      "type": "array",
      "minItems": 1,
      "items": {
        "type": "object",
        "additionalProperties": false,
        "required": ["utf8", "count"],
        "properties": {
          "utf8": { "type": "string", "minLength": 1 },
          "count": { "type": "integer", "minimum": 1, "maximum": 20000000 }
        }
      }
    },
    "stagedFile": {
      "type": "object",
      "additionalProperties": false,
      "required": ["to"],
      "properties": {
        "copy": { "$ref": "#/$defs/repositoryFile" },
        "generated": { "$ref": "#/$defs/generatedBytes" },
        "to": { "$ref": "#/$defs/workspacePath" }
      },
      "oneOf": [
        { "required": ["copy"] },
        { "required": ["generated"] }
      ]
    },
    "jsonFileSelection": {
      "type": "object",
      "additionalProperties": false,
      "required": ["file", "arrayPointer", "wherePointer", "whereEquals", "valuePointer"],
      "properties": {
        "file": { "$ref": "#/$defs/repositoryFile" },
        "arrayPointer": { "$ref": "#/$defs/jsonPointer" },
        "wherePointer": { "$ref": "#/$defs/jsonPointer" },
        "whereEquals": true,
        "valuePointer": { "$ref": "#/$defs/jsonPointer" }
      }
    },
    "jsonEquality": {
      "type": "object",
      "additionalProperties": false,
      "required": ["pointer"],
      "properties": {
        "pointer": { "$ref": "#/$defs/jsonPointer" },
        "equals": true,
        "equalsFile": {
          "type": "object",
          "additionalProperties": false,
          "required": ["file"],
          "properties": {
            "file": { "$ref": "#/$defs/repositoryFile" },
            "pointer": { "$ref": "#/$defs/jsonPointer" }
          }
        },
        "equalsSelected": { "$ref": "#/$defs/jsonFileSelection" }
      },
      "oneOf": [
        { "required": ["equals"] },
        { "required": ["equalsFile"] },
        { "required": ["equalsSelected"] }
      ]
    },
    "objectMembers": {
      "type": "object",
      "additionalProperties": false,
      "required": ["pointer", "equals"],
      "properties": {
        "pointer": { "$ref": "#/$defs/jsonPointer" },
        "equals": {
          "type": "array",
          "uniqueItems": true,
          "items": { "type": "string", "minLength": 1 }
        }
      }
    },
    "arrayLength": {
      "type": "object",
      "additionalProperties": false,
      "required": ["pointer"],
      "properties": {
        "pointer": { "$ref": "#/$defs/jsonPointer" },
        "equals": { "type": "integer", "minimum": 0 },
        "minimum": { "type": "integer", "minimum": 0 }
      },
      "oneOf": [
        { "required": ["equals"] },
        { "required": ["minimum"] }
      ]
    },
    "jsonMatcher": {
      "type": "object",
      "additionalProperties": false,
      "required": ["encoding", "members", "equalities", "nonemptyStrings"],
      "properties": {
        "encoding": { "const": "json" },
        "members": {
          "type": "array",
          "items": { "$ref": "#/$defs/objectMembers" }
        },
        "arrays": {
          "type": "array",
          "items": { "$ref": "#/$defs/arrayLength" }
        },
        "equalities": {
          "type": "array",
          "items": { "$ref": "#/$defs/jsonEquality" }
        },
        "nonemptyStrings": {
          "type": "array",
          "uniqueItems": true,
          "items": { "$ref": "#/$defs/jsonPointer" }
        }
      }
    },
    "byteMatcher": {
      "type": "object",
      "additionalProperties": false,
      "required": ["encoding"],
      "properties": {
        "encoding": { "const": "bytes" },
        "equalsFile": { "$ref": "#/$defs/repositoryFile" },
        "equalsUtf8": { "type": "string" }
      },
      "oneOf": [
        { "required": ["equalsFile"] },
        { "required": ["equalsUtf8"] }
      ]
    },
    "nativeTextMatcher": {
      "type": "object",
      "additionalProperties": false,
      "required": ["encoding", "contains", "excludes", "ansi"],
      "properties": {
        "encoding": { "const": "native-text" },
        "contains": {
          "type": "array",
          "uniqueItems": true,
          "items": { "type": "string", "minLength": 1 }
        },
        "excludes": {
          "type": "array",
          "uniqueItems": true,
          "items": { "type": "string", "minLength": 1 }
        },
        "ansi": { "const": false },
        "packageVersion": { "const": true }
      },
      "anyOf": [
        { "properties": { "contains": { "type": "array", "minItems": 1 } } },
        { "required": ["packageVersion"] }
      ]
    },
    "jsonLineRecord": {
      "type": "object",
      "required": ["level", "event", "operation"],
      "properties": {
        "level": {
          "enum": ["trace", "debug", "info", "warn", "error", "fatal"]
        },
        "event": { "type": "string", "minLength": 1 },
        "operation": { "type": "string", "minLength": 1 }
      },
      "additionalProperties": {
        "oneOf": [
          { "type": "string" },
          { "type": "number" },
          { "type": "boolean" }
        ]
      },
      "propertyNames": {
        "not": {
          "enum": [
            "timestamp",
            "time",
            "fiberId",
            "runtimeId",
            "span",
            "spans",
            "document",
            "documentContents",
            "rawMessage",
            "dependencyMessage",
            "cause",
            "stack"
          ]
        }
      }
    },
    "jsonLinesMatcher": {
      "type": "object",
      "additionalProperties": false,
      "required": ["encoding"],
      "properties": {
        "encoding": { "const": "json-lines" },
        "equalsFile": { "$ref": "#/$defs/repositoryFile" },
        "contains": {
          "type": "array",
          "minItems": 1,
          "items": { "$ref": "#/$defs/jsonLineRecord" }
        },
        "allowAdditional": { "type": "boolean" }
      },
      "oneOf": [
        { "required": ["equalsFile"] },
        { "required": ["contains", "allowAdditional"] }
      ]
    },
    "stderrMatcher": {
      "oneOf": [
        { "$ref": "#/$defs/byteMatcher" },
        { "$ref": "#/$defs/nativeTextMatcher" },
        { "$ref": "#/$defs/jsonLinesMatcher" }
      ]
    },
    "createdFile": {
      "type": "object",
      "additionalProperties": false,
      "required": ["path"],
      "properties": {
        "path": { "$ref": "#/$defs/workspacePath" },
        "equalsFile": { "$ref": "#/$defs/repositoryFile" },
        "equalsStdin": { "const": true }
      },
      "oneOf": [
        { "required": ["equalsFile"] },
        { "required": ["equalsStdin"] }
      ]
    },
    "treeState": {
      "type": "object",
      "additionalProperties": false,
      "required": ["created", "unchanged", "absent"],
      "properties": {
        "created": {
          "type": "array",
          "items": { "$ref": "#/$defs/createdFile" }
        },
        "unchanged": {
          "type": "array",
          "uniqueItems": true,
          "items": { "$ref": "#/$defs/workspacePath" }
        },
        "absent": {
          "type": "array",
          "uniqueItems": true,
          "items": { "$ref": "#/$defs/workspacePath" }
        }
      }
    },
    "filesystemExpectation": {
      "type": "object",
      "additionalProperties": false,
      "required": ["workspace", "home"],
      "properties": {
        "workspace": { "$ref": "#/$defs/treeState" },
        "home": { "$ref": "#/$defs/treeState" }
      }
    },
    "expectation": {
      "type": "object",
      "additionalProperties": false,
      "required": ["stdout", "stderr", "exitCode", "filesystem"],
      "properties": {
        "stdout": {
          "oneOf": [
            { "$ref": "#/$defs/jsonMatcher" },
            { "$ref": "#/$defs/byteMatcher" },
            { "$ref": "#/$defs/nativeTextMatcher" }
          ]
        },
        "stderr": { "$ref": "#/$defs/stderrMatcher" },
        "exitCode": { "enum": [0, 1, 2] },
        "filesystem": { "$ref": "#/$defs/filesystemExpectation" }
      }
    }
  }
}
