{
  "id": "create-stdin",
  "command": "fs",
  "arguments": ["create", "-", "--output", "result.json"],
  "workspace": [],
  "stdin": { "file": "../raw-input/noncanonical-valid.json" },
  "expect": {
    "stdout": {
      "encoding": "json",
      "members": [
        { "pointer": "", "equals": ["validation", "snapshotDiff", "output", "help"] },
        { "pointer": "/output", "equals": ["status", "path"] }
      ],
      "equalities": [
        {
          "pointer": "/validation",
          "equalsFile": { "file": "../calculation-results/no-rules.json" }
        },
        {
          "pointer": "/snapshotDiff",
          "equalsFile": { "file": "../snapshot-diffs/not-recorded.json" }
        },
        { "pointer": "/output/status", "equals": "created" },
        { "pointer": "/output/path", "equals": "result.json" },
        { "pointer": "/help", "equals": [] }
      ],
      "nonemptyStrings": []
    },
    "stderr": { "encoding": "bytes", "equalsUtf8": "" },
    "exitCode": 0,
    "filesystem": {
      "workspace": {
        "created": [{ "path": "result.json", "equalsStdin": true }],
        "unchanged": [],
        "absent": []
      },
      "home": { "created": [], "unchanged": [], "absent": [] }
    }
  }
}
