{
  "id": "discovery-unknown-command",
  "command": "fs",
  "arguments": ["unknown"],
  "workspace": [
    { "copy": "../valid/no-rollups.json", "to": "unknown" }
  ],
  "stdin": null,
  "expect": {
    "stdout": {
      "encoding": "native-text",
      "contains": ["USAGE", "fs", "guide", "schema", "example", "validate", "create"],
      "excludes": ["wizard", "prompt", "interactive"],
      "ansi": false
    },
    "stderr": {
      "encoding": "native-text",
      "contains": ["unknown"],
      "excludes": [],
      "ansi": false
    },
    "exitCode": 2,
    "filesystem": {
      "workspace": { "created": [], "unchanged": ["unknown"], "absent": [] },
      "home": { "created": [], "unchanged": [], "absent": [] }
    }
  }
}
