{
  "id": "help-validate",
  "command": "fs",
  "arguments": ["validate", "--help"],
  "workspace": [],
  "stdin": null,
  "expect": {
    "stdout": {
      "encoding": "native-text",
      "contains": [
        "USAGE",
        "fs validate",
        "document...",
        "Exactly one",
        "--help",
        "--version",
        "--completions",
        "--log-level"
      ],
      "excludes": ["--format", "wizard", "prompt", "interactive"],
      "ansi": false
    },
    "stderr": { "encoding": "bytes", "equalsUtf8": "" },
    "exitCode": 0,
    "filesystem": {
      "workspace": { "created": [], "unchanged": [], "absent": [] },
      "home": { "created": [], "unchanged": [], "absent": [] }
    }
  }
}
