{
  "id": "example-output-missing-parent",
  "command": "fs",
  "arguments": ["example", "--output", "missing/minimal.json", "minimal"],
  "workspace": [],
  "stdin": null,
  "expect": {
    "stdout": {
      "encoding": "json",
      "members": [
        { "pointer": "", "equals": ["error", "help"] },
        { "pointer": "/error", "equals": ["operation", "code", "message", "path"] }
      ],
      "equalities": [
        { "pointer": "/error/operation", "equals": "example" },
        { "pointer": "/error/code", "equals": "output-parent-not-found" },
        { "pointer": "/error/path", "equals": "missing/minimal.json" },
        { "pointer": "/help", "equals": [{ "executable": "fs", "arguments": ["example","--output","<new-path>","minimal"] }] }
      ],
      "nonemptyStrings": ["/error/message"]
    },
    "stderr": { "encoding": "bytes", "equalsUtf8": "" },
    "exitCode": 1,
    "filesystem": {
      "workspace": { "created": [], "unchanged": [], "absent": ["missing/minimal.json"] },
      "home": { "created": [], "unchanged": [], "absent": [] }
    }
  }
}
