{
  "id": "validate-json-value-limit",
  "command": "fs",
  "arguments": ["validate", "input.json"],
  "workspace": [
    {
      "generated": [
        { "utf8": "[", "count": 1 },
        { "utf8": "null,", "count": 199999 },
        { "utf8": "null]", "count": 1 }
      ],
      "to": "input.json"
    }
  ],
  "stdin": null,
  "expect": {
    "stdout": {
      "encoding": "json",
      "members": [
        { "pointer": "", "equals": ["error", "help"] },
        { "pointer": "/error", "equals": ["operation", "code", "message", "path", "budget", "limit"] }
      ],
      "equalities": [
        { "pointer": "/error/operation", "equals": "validate" },
        { "pointer": "/error/code", "equals": "input-limit-exceeded" },
        { "pointer": "/error/path", "equals": "input.json" },
        { "pointer": "/error/budget", "equals": "json-values" },
        { "pointer": "/error/limit", "equals": 200000 },
        { "pointer": "/help", "equals": [] }
      ],
      "nonemptyStrings": ["/error/message"]
    },
    "stderr": { "encoding": "bytes", "equalsUtf8": "" },
    "exitCode": 1,
    "filesystem": {
      "workspace": { "created": [], "unchanged": ["input.json"], "absent": [] },
      "home": { "created": [], "unchanged": [], "absent": [] }
    }
  }
}
