{
  "id": "schema-validation-result-default",
  "command": "fs",
  "arguments": ["schema", "validation-result"],
  "workspace": [],
  "stdin": null,
  "expect": {
    "stdout": { "encoding": "bytes", "equalsFile": "../../schema/validation-result.schema.json" },
    "stderr": { "encoding": "bytes", "equalsUtf8": "" },
    "exitCode": 0,
    "filesystem": {
      "workspace": { "created": [], "unchanged": [], "absent": [] },
      "home": { "created": [], "unchanged": [], "absent": [] }
    }
  }
}
