{
  "id": "help-root",
  "command": "fs",
  "arguments": ["--help"],
  "workspace": [],
  "stdin": null,
  "expect": {
    "stdout": {
      "encoding": "native-text",
      "contains": [
        "USAGE",
        "fs",
        "--help",
        "--version",
        "--completions",
        "<bash|zsh|fish|sh>",
        "--log-level",
        "<all|trace|debug|info|warn|warning|error|fatal|none>",
        "defaults to none",
        "guide",
        "schema",
        "example",
        "validate",
        "create",
        "record-validation",
        "render"
      ],
      "excludes": ["wizard", "prompt", "interactive"],
      "ansi": false
    },
    "stderr": { "encoding": "bytes", "equalsUtf8": "" },
    "exitCode": 0,
    "filesystem": {
      "workspace": { "created": [], "unchanged": [], "absent": [] },
      "home": { "created": [], "unchanged": [], "absent": [] }
    }
  }
}
