{
  "id": "schema-unsupported-version",
  "command": "fs",
  "arguments": ["schema", "document", "--version", "1.0"],
  "workspace": [],
  "stdin": null,
  "expect": {
    "stdout": {
      "encoding": "json",
      "members": [
        { "pointer": "", "equals": ["error", "help"] },
        { "pointer": "/error", "equals": ["operation", "code", "message"] }
      ],
      "equalities": [
        { "pointer": "/error/operation", "equals": "schema" },
        { "pointer": "/error/code", "equals": "unsupported-version" },
        { "pointer": "/help", "equals": ["fs schema document --version 0.1"] }
      ],
      "nonemptyStrings": ["/error/message"]
    },
    "stderr": { "encoding": "bytes", "equalsUtf8": "" },
    "exitCode": 2,
    "filesystem": {
      "workspace": { "created": [], "unchanged": [], "absent": [] },
      "home": { "created": [], "unchanged": [], "absent": [] }
    }
  }
}
