{
  "id": "render-unknown-flag",
  "command": "fs",
  "arguments": ["render", "--output", "report.html", "missing.json", "--unknown"],
  "workspace": [],
  "stdin": null,
  "expect": {
    "stdout": {
      "encoding": "native-text",
      "contains": ["USAGE", "fs render", "document...", "Exactly one", "--output"],
      "excludes": ["wizard", "prompt", "interactive"],
      "ansi": false
    },
    "stderr": { "encoding": "native-text", "contains": ["--unknown"], "excludes": [], "ansi": false },
    "exitCode": 2,
    "filesystem": {
      "workspace": {
        "created": [],
        "unchanged": [],
        "absent": ["missing.json", "report.html"]
      },
      "home": { "created": [], "unchanged": [], "absent": [] }
    }
  }
}
