{
  "id": "schema-snapshot-diff-explicit-version",
  "command": "fs",
  "arguments": ["schema", "snapshot-diff", "--version", "0.1"],
  "workspace": [],
  "stdin": null,
  "expect": {
    "stdout": { "encoding": "bytes", "equalsFile": "../../schema/snapshot-diff.schema.json" },
    "stderr": { "encoding": "bytes", "equalsUtf8": "" },
    "exitCode": 0,
    "filesystem": {
      "workspace": { "created": [], "unchanged": [], "absent": [] },
      "home": { "created": [], "unchanged": [], "absent": [] }
    }
  }
}
